{
  "schema": "hhy.r02.test-evidence/v1",
  "report_id": "r02-a1893b20-external",
  "suite": "r02-java21-pg17-android-real-api",
  "producer": "TASK-R02-006 controlled integration",
  "generated_at": "2026-07-18T10:44:03.726509Z",
  "source_commit": "a1893b20709c474c4cbe421f4bd1dc7eecaacebf",
  "command": [
    "mvn verify",
    "bash scripts/run_postgres_migration_smoke.sh",
    "./gradlew --no-daemon testDebugUnitTest lintDebug assembleDebug",
    "pnpm --dir apps/h5 test && pnpm --dir apps/h5 run typecheck && pnpm --dir apps/h5 run build"
  ],
  "environment": {
    "java": "Eclipse Temurin 21",
    "maven": "Apache Maven 3.9.11",
    "postgresql": "PostgreSQL 17.10 disposable container",
    "android_image": "hhy-android-toolchain:r01-46fb273@sha256:97a5b2d7ae4d6c4abab0c985b502597d0612f3a1e0941fd842008e30a4632607",
    "api_base_url": "https://api.orbexa.cc"
  },
  "results": [
    {
      "test_id": "TST-AUTH_001-HAPPY",
      "status": "PASS",
      "executed": true,
      "exit_code": 0,
      "started_at": "2026-07-18T10:42:45Z",
      "finished_at": "2026-07-18T10:43:31Z",
      "assertions": [
        {
          "name": "UserAuthSuccessContractTest#refreshSuccessMatchesFrozenEnvelopeAndSessionShape",
          "status": "PASS"
        }
      ],
      "artifacts": [
        {
          "path": "maven-verify.log",
          "sha256": "dabc4376718aca1128429369abc346b25c3fe54a7bbd330260f90be0bd6efd4a"
        },
        {
          "path": "postgres17-smoke.log",
          "sha256": "60edb27f8d28013a4b0739156a92f866a84b73974c633440154af70a62f3c2b2"
        }
      ],
      "details": "Executed by the frozen R02 external integration jobs; artifacts are content-addressed."
    },
    {
      "test_id": "TST-AUTH_001-IDEMPOTENT",
      "status": "PASS",
      "executed": true,
      "exit_code": 0,
      "started_at": "2026-07-18T10:42:45Z",
      "finished_at": "2026-07-18T10:43:31Z",
      "assertions": [
        {
          "name": "UserAuthServiceTest#refreshRotatesSecretsAndReplaysTheEncryptedFirstResponse",
          "status": "PASS"
        }
      ],
      "artifacts": [
        {
          "path": "maven-verify.log",
          "sha256": "dabc4376718aca1128429369abc346b25c3fe54a7bbd330260f90be0bd6efd4a"
        },
        {
          "path": "postgres17-smoke.log",
          "sha256": "60edb27f8d28013a4b0739156a92f866a84b73974c633440154af70a62f3c2b2"
        }
      ],
      "details": "Executed by the frozen R02 external integration jobs; artifacts are content-addressed."
    },
    {
      "test_id": "TST-AUTH_001-REJECT",
      "status": "PASS",
      "executed": true,
      "exit_code": 0,
      "started_at": "2026-07-18T10:42:45Z",
      "finished_at": "2026-07-18T10:43:31Z",
      "assertions": [
        {
          "name": "UserBearerAuthenticationFilterTest#deniesTokenWhenItsPersistedSessionIsNoLongerActive",
          "status": "PASS"
        }
      ],
      "artifacts": [
        {
          "path": "maven-verify.log",
          "sha256": "dabc4376718aca1128429369abc346b25c3fe54a7bbd330260f90be0bd6efd4a"
        },
        {
          "path": "postgres17-smoke.log",
          "sha256": "60edb27f8d28013a4b0739156a92f866a84b73974c633440154af70a62f3c2b2"
        }
      ],
      "details": "Executed by the frozen R02 external integration jobs; artifacts are content-addressed."
    },
    {
      "test_id": "TST-AUTH_001-SECURITY",
      "status": "PASS",
      "executed": true,
      "exit_code": 0,
      "started_at": "2026-07-18T10:42:45Z",
      "finished_at": "2026-07-18T10:43:31Z",
      "assertions": [
        {
          "name": "UserTokenServiceTest#rejectsNonCanonicalSignatureEncodingEvenWhenBytesAreUnchanged",
          "status": "PASS"
        }
      ],
      "artifacts": [
        {
          "path": "maven-verify.log",
          "sha256": "dabc4376718aca1128429369abc346b25c3fe54a7bbd330260f90be0bd6efd4a"
        },
        {
          "path": "postgres17-smoke.log",
          "sha256": "60edb27f8d28013a4b0739156a92f866a84b73974c633440154af70a62f3c2b2"
        }
      ],
      "details": "Executed by the frozen R02 external integration jobs; artifacts are content-addressed."
    },
    {
      "test_id": "TST-AUTH_002-HAPPY",
      "status": "PASS",
      "executed": true,
      "exit_code": 0,
      "started_at": "2026-07-18T10:42:45Z",
      "finished_at": "2026-07-18T10:43:31Z",
      "assertions": [
        {
          "name": "UserAuthServiceTest#passwordLoginVerifiesChallengeAndCreatesDeviceBoundSession",
          "status": "PASS"
        }
      ],
      "artifacts": [
        {
          "path": "maven-verify.log",
          "sha256": "dabc4376718aca1128429369abc346b25c3fe54a7bbd330260f90be0bd6efd4a"
        },
        {
          "path": "postgres17-smoke.log",
          "sha256": "60edb27f8d28013a4b0739156a92f866a84b73974c633440154af70a62f3c2b2"
        }
      ],
      "details": "Executed by the frozen R02 external integration jobs; artifacts are content-addressed."
    },
    {
      "test_id": "TST-AUTH_002-IDEMPOTENT",
      "status": "PASS",
      "executed": true,
      "exit_code": 0,
      "started_at": "2026-07-18T10:42:45Z",
      "finished_at": "2026-07-18T10:43:31Z",
      "assertions": [
        {
          "name": "UserAuthServiceTest#sameKeyWithDifferentIntentReturnsFrozenIdempotencyConflict",
          "status": "PASS"
        }
      ],
      "artifacts": [
        {
          "path": "maven-verify.log",
          "sha256": "dabc4376718aca1128429369abc346b25c3fe54a7bbd330260f90be0bd6efd4a"
        },
        {
          "path": "postgres17-smoke.log",
          "sha256": "60edb27f8d28013a4b0739156a92f866a84b73974c633440154af70a62f3c2b2"
        }
      ],
      "details": "Executed by the frozen R02 external integration jobs; artifacts are content-addressed."
    },
    {
      "test_id": "TST-AUTH_002-REJECT",
      "status": "PASS",
      "executed": true,
      "exit_code": 0,
      "started_at": "2026-07-18T10:42:45Z",
      "finished_at": "2026-07-18T10:43:31Z",
      "assertions": [
        {
          "name": "UserAuthServiceTest#passwordLoginLocksAccountAfterConfiguredFailureThresholdWithoutCreatingSession",
          "status": "PASS"
        }
      ],
      "artifacts": [
        {
          "path": "maven-verify.log",
          "sha256": "dabc4376718aca1128429369abc346b25c3fe54a7bbd330260f90be0bd6efd4a"
        },
        {
          "path": "postgres17-smoke.log",
          "sha256": "60edb27f8d28013a4b0739156a92f866a84b73974c633440154af70a62f3c2b2"
        }
      ],
      "details": "Executed by the frozen R02 external integration jobs; artifacts are content-addressed."
    },
    {
      "test_id": "TST-AUTH_002-SECURITY",
      "status": "PASS",
      "executed": true,
      "exit_code": 0,
      "started_at": "2026-07-18T10:42:45Z",
      "finished_at": "2026-07-18T10:43:31Z",
      "assertions": [
        {
          "name": "UserAuthPublicRejectionContractTest#shortIdempotencyHeaderRejectsPasswordLoginBeforeServiceInvocation",
          "status": "PASS"
        }
      ],
      "artifacts": [
        {
          "path": "maven-verify.log",
          "sha256": "dabc4376718aca1128429369abc346b25c3fe54a7bbd330260f90be0bd6efd4a"
        },
        {
          "path": "postgres17-smoke.log",
          "sha256": "60edb27f8d28013a4b0739156a92f866a84b73974c633440154af70a62f3c2b2"
        }
      ],
      "details": "Executed by the frozen R02 external integration jobs; artifacts are content-addressed."
    },
    {
      "test_id": "TST-AUTH_003-HAPPY",
      "status": "PASS",
      "executed": true,
      "exit_code": 0,
      "started_at": "2026-07-18T10:42:45Z",
      "finished_at": "2026-07-18T10:43:31Z",
      "assertions": [
        {
          "name": "UserAuthServiceTest#smsLoginVerifiesCodeAndCreatesDeviceBoundSession",
          "status": "PASS"
        }
      ],
      "artifacts": [
        {
          "path": "maven-verify.log",
          "sha256": "dabc4376718aca1128429369abc346b25c3fe54a7bbd330260f90be0bd6efd4a"
        },
        {
          "path": "postgres17-smoke.log",
          "sha256": "60edb27f8d28013a4b0739156a92f866a84b73974c633440154af70a62f3c2b2"
        }
      ],
      "details": "Executed by the frozen R02 external integration jobs; artifacts are content-addressed."
    },
    {
      "test_id": "TST-AUTH_003-IDEMPOTENT",
      "status": "PASS",
      "executed": true,
      "exit_code": 0,
      "started_at": "2026-07-18T10:42:45Z",
      "finished_at": "2026-07-18T10:43:31Z",
      "assertions": [
        {
          "name": "UserAuthVerificationServiceTest#validSmsCodeIsConsumedExactlyOnce",
          "status": "PASS"
        }
      ],
      "artifacts": [
        {
          "path": "maven-verify.log",
          "sha256": "dabc4376718aca1128429369abc346b25c3fe54a7bbd330260f90be0bd6efd4a"
        },
        {
          "path": "postgres17-smoke.log",
          "sha256": "60edb27f8d28013a4b0739156a92f866a84b73974c633440154af70a62f3c2b2"
        }
      ],
      "details": "Executed by the frozen R02 external integration jobs; artifacts are content-addressed."
    },
    {
      "test_id": "TST-AUTH_003-REJECT",
      "status": "PASS",
      "executed": true,
      "exit_code": 0,
      "started_at": "2026-07-18T10:42:45Z",
      "finished_at": "2026-07-18T10:43:31Z",
      "assertions": [
        {
          "name": "UserAuthVerificationServiceTest#invalidSmsCodeRecordsFailureWithoutConsumingTheCode",
          "status": "PASS"
        }
      ],
      "artifacts": [
        {
          "path": "maven-verify.log",
          "sha256": "dabc4376718aca1128429369abc346b25c3fe54a7bbd330260f90be0bd6efd4a"
        },
        {
          "path": "postgres17-smoke.log",
          "sha256": "60edb27f8d28013a4b0739156a92f866a84b73974c633440154af70a62f3c2b2"
        }
      ],
      "details": "Executed by the frozen R02 external integration jobs; artifacts are content-addressed."
    },
    {